id;title;post_slug;post_content;post_like;post_status;created_by;modified_by;created_date;modified_date
1;mobile Fish;Home Loan Account Table Computer;Trace;33370;Metal deposit;admin;admin;1557873258;1557873258
2;Producer;Implementation Electronics Officer;methodology Albania;43194;intangible;admin;admin;1557873258;1557873258
3;enable Gorgeous Frozen Pants;Common;Savings Account syndicate Planner;46676;HDD;admin;admin;1557873258;1557873258
4;Table Small Frozen Sausages Planner;envisioneer Music Public-key;infomediaries;12203;Buckinghamshire Games;admin;admin;1557873258;1557873258
5;incentivize Tuna copy;Costa Rica Mayotte;Industrial;84228;Views e-enable Communications;admin;admin;1557873258;1557873258
6;National Awesome sky blue;Tactics;scale interactive generating;35675;mission-critical Faroe Islands Plastic;admin;admin;1557873258;1557873258
7;Car Industrial deliverables;orange Books;magenta monitor 1080p;60595;Identity;admin;admin;1557873258;1557873258
8;Frozen IB;Highway Ergonomic;moratorium moratorium;72960;withdrawal COM;admin;admin;1557873258;1557873258
9;embrace Developer;synthesize Idaho compress;Sleek Metal Table Small;43933;red;admin;admin;1557873258;1557873258
10;withdrawal knowledge base Buckinghamshire;Concrete Investment Account Saint Lucia;User-centric;7697;neutral Salad;admin;admin;1557873258;1557873258
